term,Study Title,Study URL,Study Status,Brief Summary,Study Results,Conditions,Interventions,Primary Outcome Measures,Secondary Outcome Measures,Other Outcome Measures,Age,Phases,Study Type,Study Design,Start Date,Primary Completion Date,Completion Date,Locations,results
NCT03379727,Study to Assess the Safety and Efficacy of Midostaurin (PKC412) in Combination With Standard Chemotherapy During Induction and Consolidation Followed by 12 Months of Maintenance Monotherapy in Patients With Newly-diagnosed FMS-like Tyrosine 3 (FLT3) Kinase Receptor-mutated Acute Myeloid Leukemia.,https://clinicaltrials.gov/study/NCT03379727,COMPLETED,The purpose of this study was to gather and evaluate additional safety and efficacy data on the combination of midostaurin and standard of care for adult patients with newly diagnosed Fms-like tyrosine kinase receptor (FLT3) mutated Acute Myeloid Leukemia (AML) who were eligible for standard induction and consolidation,YES,Acute Myeloid Leukemia,DRUG: Midostaurin|DRUG: Cytarabine|DRUG: anthracycline ((daunorubicin or idarubicin): Induction Phase only,"Percentage of Patients With Adverse Events (AEs), Grade 3 & 4 AEs, Serious Adverse Events (SAEs), AEs Leading to Discontinuation, and Deaths up to 24 Months (M24)., Safety of Midostaurin was represented by various types of AEs, SAEs \& death up to M24. AE: the appearance of (or worsening of any pre-existing) undesirable sign(s), symptom(s), or medical condition(s) that occur after patient's signed informed consent has been obtained. AE grades to characterize the severity of AEs were based on the Common Terminology Criteria for AEs ver. 4.03 with Grade (Gr) 1: mild; Gr 2: moderate; Gr 3: severe; Gr 4: life-threatening; Gr 5: death related to AE. AEs not related to hematological toxicities were generally of grade 1 or 2 severity. SAE: 1 of the following: is fatal or life-threatening, results in persistent or significant disability/incapacity, constitutes a congenital anomaly/birth defect, is medically significant, i.e. an event that jeopardizes the patient or may require medical or surgical intervention to prevent 1 of the outcomes listed above, requires inpatient hospitalization or prolongation of existing hospitalization with a few exceptions., Baseline up to approximatly 24 months","Percentage of Patients With Complete Remission (CR) or Complete Remission With Incomplete Hematologic Recovery (CRi) as Per Local Assessment, CR/CRi rate is defined as the percentage of patients with complete remission (CR) or complete remission with incomplete hematologic recovery (CRi) as per local assessment in Induction, Consolidation and Maintenance phases. CR/CRi rate was calculated based on the full analysis set (FAS).

Complete remission (CR): Bone marrow blasts \<5% with spicules; absence of blasts with Auer rods; absence of extramedullary disease; absolute neutrophil count (ANC) \>1.0 x109/L; platelet count \>100 x 109/L; independence of red cell transfusions.

CR with incomplete recovery (CRi): All CR criteria except for residual neutropenia (\<1.0 x109/L) or thrombocytopenia (\<100 x 109/L), Baseline up to approximately 24 months",,"ADULT, OLDER_ADULT",PHASE3,INTERVENTIONAL,Allocation: NA|Intervention Model: SINGLE_GROUP|Masking: NONE|Primary Purpose: TREATMENT,2018-02-13,2021-07-09,2021-07-09,"Novartis Investigative Site, Pleven, 5800, Bulgaria|Novartis Investigative Site, Sofia, 1413, Bulgaria|Novartis Investigative Site, Sofia, 1756, Bulgaria|Novartis Investigative Site, Varna, 9000, Bulgaria|Novartis Investigative Site, Zagreb, 10000, Croatia|Novartis Investigative Site, Brno, 625 00, Czechia|Novartis Investigative Site, Praha 10, 100 34, Czechia|Novartis Investigative Site, Tallinn, 13419, Estonia|Novartis Investigative Site, Helsinki, FIN 00290, Finland|Novartis Investigative Site, Oulu, FIN-90220, Finland|Novartis Investigative Site, Tampere, 33521, Finland|Novartis Investigative Site, Bayonne, Bayonne Cedex, 64109, France|Novartis Investigative Site, Saint Priest en Jarez, Loire, 42270, France|Novartis Investigative Site, Besancon cedex, 25030, France|Novartis Investigative Site, Clamart, 92141, France|Novartis Investigative Site, Creteil, 94010, France|Novartis Investigative Site, Dijon, 21034, France|Novartis Investigative Site, Lille Cedex, 59037, France|Novartis Investigative Site, Limoges cedex, 87042, France|Novartis Investigative Site, Lyon, 69373, France|Novartis Investigative Site, Metz, 57085, France|Novartis Investigative Site, Nice Cedex, 06202, France|Novartis Investigative Site, Paris Cedex 10, 75475, France|Novartis Investigative Site, Paris, 75012, France|Novartis Investigative Site, Pierre Benite, 69495, France|Novartis Investigative Site, Poitiers, 86000, France|Novartis Investigative Site, Villejuif Cedex, 94800, France|Novartis Investigative Site, Budapest, 1085, Hungary|Novartis Investigative Site, Szeged, H 6725, Hungary|Novartis Investigative Site, Ancona, AN, 60126, Italy|Novartis Investigative Site, Avellino, AV, 83100, Italy|Novartis Investigative Site, Bergamo, BG, 24127, Italy|Novartis Investigative Site, Bologna, BO, 40138, Italy|Novartis Investigative Site, Brescia, BS, 25123, Italy|Novartis Investigative Site, Cuneo, CN, 12100, Italy|Novartis Investigative Site, Cosenza, CS, 87100, Italy|Novartis Investigative Site, San Giovanni Rotondo, FG, 71013, Italy|Novartis Investigative Site, Firenze, FI, 50134, Italy|Novartis Investigative Site, Genova, GE, 16132, Italy|Novartis Investigative Site, Lecce, LE, 73100, Italy|Novartis Investigative Site, Latina, LT, 04100, Italy|Novartis Investigative Site, Monza, MB, 20900, Italy|Novartis Investigative Site, Milano, MI, 20122, Italy|Novartis Investigative Site, Milano, MI, 20132, Italy|Novartis Investigative Site, Milano, MI, 20162, Italy|Novartis Investigative Site, Rozzano, MI, 20089, Italy|Novartis Investigative Site, Modena, MO, 41124, Italy|Novartis Investigative Site, Palermo, PA, 90146, Italy|Novartis Investigative Site, Piacenza, PC, 29100, Italy|Novartis Investigative Site, Padova, PD, 35128, Italy|Novartis Investigative Site, Pescara, PE, 65124, Italy|Novartis Investigative Site, Perugia, PG, 06100, Italy|Novartis Investigative Site, Parma, PR, 43100, Italy|Novartis Investigative Site, Reggio Emilia, RE, 42123, Italy|Novartis Investigative Site, Roma, RM, 00128, Italy|Novartis Investigative Site, Roma, RM, 00133, Italy|Novartis Investigative Site, Roma, RM, 00161, Italy|Novartis Investigative Site, Roma, RM, 00168, Italy|Novartis Investigative Site, Salerno, SA, 84131, Italy|Novartis Investigative Site, Siena, SI, 53100, Italy|Novartis Investigative Site, Torino, TO, 10128, Italy|Novartis Investigative Site, Venezia, VE, 30174, Italy|Novartis Investigative Site, Verona, VR, 37126, Italy|Novartis Investigative Site, Napoli, 80131, Italy|Novartis Investigative Site, Napoli, 80132, Italy|Novartis Investigative Site, Vilnius, LT-08661, Lithuania|Novartis Investigative Site, Bergen, 5021, Norway|Novartis Investigative Site, Craiova, 200136, Romania|Novartis Investigative Site, Iasi, 700483, Romania|Novartis Investigative Site, Belgrade, 11000, Serbia|Novartis Investigative Site, Bratislava, Slovak Republic, 833 10, Slovakia|Novartis Investigative Site, Banska Bystrica, 975 17, Slovakia|Novartis Investigative Site, Bratislava, 85107, Slovakia|Novartis Investigative Site, Barcelona, Cataluna, 08026, Spain|Novartis Investigative Site, Barcelona, Catalunya, 08036, Spain|Novartis Investigative Site, Palma De Mallorca, Islas Baleares, 07120, Spain|Novartis Investigative Site, Pozuelo de Alarcon, Madrid, 28223, Spain|Novartis Investigative Site, Gasteiz, País Vasco, 01009, Spain|Novartis Investigative Site, La Laguna, Santa Cruz De Tenerife, 38320, Spain|Novartis Investigative Site, Las Palmas de Gran Canaria, 35010, Spain|Novartis Investigative Site, Leon, 24080, Spain|Novartis Investigative Site, Madrid, 28006, Spain|Novartis Investigative Site, Madrid, 28046, Spain|Novartis Investigative Site, Valencia, 46026, Spain|Novartis Investigative Site, Boras, 501 82, Sweden|Novartis Investigative Site, Uppsala, SE-751 85, Sweden",1
NCT05563207,Application of Health Education Path of Traditional Chinese Medicine Nursin,https://clinicaltrials.gov/study/NCT05563207,COMPLETED,"To explore the effect of traditional Chinese medicine (TCM) health education standard path on the treatment of patients with acute myeloid leukemia (AML). A total of 60 patients with acute myeloid leukemia in Shijiazhuang Ping An Hospital were selected and divided into control group (n=30) and observation group (n=30) according to the time of admission. Both groups received the same chemotherapy, the control group received routine nursing, and the observation group received TCM health education standard path intervention. The scores of Self-rating Anxiety Scale (SAS), Self-rating Depression Scale (SDS), Spitzer Quality of Life Index (QLI), awareness of TCM health education standard path content and nursing satisfaction were compared between the two groups.",NO,Acute Myeloid Leukemia,OTHER: traditional Chinese medicine health education standard path|OTHER: The contents of the health intervention mainly included:Graphic and text education|OTHER: The contents of the health intervention mainly included:Language education|OTHER: The contents of the health intervention mainly included:Psychological education|OTHER: The contents of the health intervention mainly included:Dietary education|OTHER: The contents of the health intervention mainly included:Complication education,"Self-rating anxiety scale, evaluate the anxiety of the two groups of patients before and after intervention, 3 months of intervention|self-rating depression scale, evaluate depression of the two groups of patients before and after intervention, 3 months of intervention|Quality of Life Index, the Spitzer Quality of Life Index (QLI) was used to evaluate the quality of life of patients, 3 months of intervention|Self-made questionnaires to compare the awareness of traditional Chinese medicine health education standard path content, 5 items of propaganda and education content, propaganda and education form, professional level of propaganda and education, nurses' professional attitude, and propaganda and education effect, 3 months of intervention|Self-made questionnaires to compare nursing satisfaction, evaluate the nursing attitude, nursing skills, and explanations of medical staff, 3 months of intervention",,,"ADULT, OLDER_ADULT",,INTERVENTIONAL,"Allocation: RANDOMIZED|Intervention Model: PARALLEL|Masking: TRIPLE (PARTICIPANT, CARE_PROVIDER, OUTCOMES_ASSESSOR)|Primary Purpose: SUPPORTIVE_CARE",2021-03-01,2022-05-31,2022-05-31,"Shijiazhuang Pingan Hospital, Shijiazhuang, Hebei, 050021, China",1
NCT04789655,Study of CC-96191 in Participants With Relapsed or Refractory Acute Myeloid Leukemia,https://clinicaltrials.gov/study/NCT04789655,ACTIVE_NOT_RECRUITING,"This Phase 1, clinical study of CC-96191 will explore the safety, tolerability and preliminary biological and clinical activity of CC-96191 as a single-agent in the setting of Relapsed or refractory acute myeloid leukemia (R/R AML).

The dose escalation (Part A) of the study will explore escalating intravenous doses of CC-96191 to estimate the MTD and/or RP2D of CC-96191 as monotherapy.

The expansion (Part B), will further evaluate the safety and efficacy of CC-96191 administered at or below the MTD in one or more expansion cohorts in order to determine the RP2D.",NO,"Leukemia, Myeloid",DRUG: CC-96191,"Dose limiting toxicities (DLTs), Are defined as toxicities that meet the protocol-specified criteria occurring within the DLT assessment window (Cycle 1, Days 1 to at least 28 and up to 42 days) that cannot be attributed to a clearly identifiable cause such as underlying illness, disease progression, other concurrent illness, or concomitant medication., Up to 42 days after the first dose|Maximum tolerated dose (MTD), Is defined as the highest dose at which less than 33% of the population treated with CC-96191 experience a dose limiting toxicity (DLT) in the first cycle., Up to 35 days after the last dose|Adverse Events (AEs), Type, frequency, seriousness, severity and relationship of AEs to CC-96191, Up to 35 days after the last dose","Complete remission rate (CRR), As defined by the European Leukemia Net (ELN) AML response criteria., Up to approximately 2 years|Objective response rate (ORR), As defined by the European Leukemia Net (ELN) AML response criteria., Up to approximately 2 years|Progression-free survival (PFS), Is defined as the time from the first dose of CC-96191 to the first occurrence of disease progression or death from any cause., Up to approximately 2 years|Overall survival (OS), Is measured as the time from the first dose of CC-96191 to death due to any cause., Up to approximately 2 years|Duration of remission, For subjects with best response of complete remission (CR) of any type, morphologic leukemia free state (MLFS) or partial remission (PR), duration of response (DOR) is measured from the time when criteria for CR/MLFS/PR are first met (whichever is first recorded) until the first date at which relapse, or progressive disease is objectively documented, Up to approximately 2 years|Time to remission, Time from the date of first dose to the earliest date of any response (CR of any type, MLFS or PR), Up to approximately 2 years|Pharmacokinetics - Cmax, Maximum serum concentration of drug, Up to 35 days after last dose|Pharmacokinetics - AUC, Area under the serum concentration time-curve, Up to 35 days after last dose|Pharmacokinetics - tmax, Time to peak (maximum) serum concentration, Up to 35 days after last dose|Pharmacokinetics - t1/2, Terminal half-life, Up to 35 days after last dose|Pharmacokinetics - CL, Total body clearance of the drug from the serum, Up to 35 days after last dose|Pharmacokinetics - Vss, Volume of distribution at steady-state, Up to 35 days after last dose|Presence of anti-drug antibodies (ADA), Detection of anti-drug antibodies in participants, Up to 35 days after last dose|Frequency of anti-drug antibodies (ADA), Frequency of anti-drug antibodies in participants, Up to 35 days after last dose",,"ADULT, OLDER_ADULT",PHASE1,INTERVENTIONAL,Allocation: NA|Intervention Model: SINGLE_GROUP|Masking: NONE|Primary Purpose: TREATMENT,2021-06-16,2025-04-30,2025-04-30,"Local Institution - 109, Birmingham, Alabama, 35233, United States|Local Institution - 105, Jacksonville, Florida, 32224, United States|Local Institution - 108, Atlanta, Georgia, 30322, United States|Local Institution - 110, Rochester, Minnesota, 55905, United States|Local Institution - 101, Hackensack, New Jersey, 07601, United States|Local Institution - 102, New York, New York, 10029, United States|Local Institution - 107, Houston, Texas, 77030-4009, United States|Local Institution - 111, Seattle, Washington, 98104, United States|Local Institution - 202, Calgary, Alberta, T2N 5G2, Canada|Local Institution - 201, Toronto, Ontario, M5G 2M9, Canada|Local Institution - 303, Marseille cedex, 13273, France|Local Institution - 304, Paris, 75010, France|Local Institution - 301, Pessac Cedex, 33604, France|Local Institution - 302, Villejuif CEDEX, 94805, France",1
NCT05169307,CPX-351 Real-World Effectiveness and Safety Study,https://clinicaltrials.gov/study/NCT05169307,COMPLETED,CPX-351 Real World Effectiveness and Safety Study (CREST UK) is a real-world evidence study designed to collect data on the potential benefits and/or risks of Vyxeos liposomal (liposomal daunorubicin/cytarabine; CPX-351) in routine clinical practice in the United Kingdom (UK).,NO,Acute Myeloid Leukemia,DRUG: CPX-351,"Number of Participants Achieving Complete Response/Complete Response with Incomplete Platelet or Neutrophil Recovery in Participants With AML Who Were Treated in Routine Practice With Vyxeos Liposomal, First infusion of Vyxeos liposomal (post-August 2018 approval) to inclusion in study, up to approximately 3 years 4 months|Overall Survival in Participants With AML Who Were Treated in Routine Practice With Vyxeos Liposomal, First infusion of Vyxeos liposomal (post-August 2018 approval) to date of death, up to approximately 3 years 4 months","Number of Vyxeos Liposomal Induction and Consolidation Cycles Administered (Inpatient or Outpatient) in Participants With AML Who Were Treated in Routine Practice With Vyxeos Liposomal, First infusion of Vyxeos liposomal (post-August 2018 approval) to inclusion in study, up to approximately 3 years 4 months|Dose Per Cycle of Vyxeos Liposomal Given During Induction and Consolidation Cycles Administered in Participants With AML Who Were Treated in Routine Practice With Vyxeos Liposomal, First infusion of Vyxeos liposomal (post-August 2018 approval) to inclusion in study, up to approximately 3 years 4 months|Percentage of Participants Transferred for Haematopoietic Stem Cell Transplant (HSCT) in Participants With AML Who Were Treated in Routine Practice With Vyxeos Liposomal, First infusion of Vyxeos liposomal (post-August 2018 approval) to inclusion in study, up to approximately 3 years 4 months|Overall Survival in Participants Post-HSCT With AML Who Were Treated in Routine Practice With Vyxeos Liposomal, Date of HSCT to date of death, up to approximately 3 years 4 months|Mean Duration of Hospitalization Stay of Participants With AML Who Were Treated in Routine Practice With Vyxeos Liposomal, First infusion of Vyxeos liposomal (post-August 2018 approval) to inclusion in study, up to approximately 3 years 4 months",,"ADULT, OLDER_ADULT",,OBSERVATIONAL,Observational Model: |Time Perspective: p,2022-01-14,2022-06-15,2022-06-15,"Belfast City Hospital, Belfast, BT9 7AB, United Kingdom|Bristol Royal Infirmary, Bristol, BS2 8HW, United Kingdom|University Hospitals Derby and Burton, Derby, DE22 3NE, United Kingdom|Western General Hospital (Lothian), Edinburgh, EH16 4TJ, United Kingdom|Royal Devon and Exeter, Exeter, EX2 5DW, United Kingdom|The Leeds Teaching Hospitals NHS Trust, Leeds, LS9 7TF, United Kingdom|Leicester Royal Infirmary, Leicester, LE1 5WW, United Kingdom|University College London Hospitals, London, NW1 2BU, United Kingdom|Royal Marsden, London, SW3 6JJ, United Kingdom|James Cook University Hospital, Middlesbrough, TS4 3BW, United Kingdom|Peterborough Hospital, Peterborough, PE3 9GZ, United Kingdom|Queen Alexandra Hospital, Portsmouth, Portsmouth, PO6 3LY, United Kingdom|Torbay and South Devon, Torquay, TQ2 7AA, United Kingdom|Royal Liverpool/Clatterbridge, Wirral, CH63 4JY, United Kingdom|New Cross Hospital - Wolverhampton, Wolverhampton, WV10 OQP, United Kingdom",1
NCT03796533,Pharmacokinetics Variability of Posaconazole (PCZ) and Its Glucuronide Metabolite During Induction and Consolidation Treatments in Patients With Acute Myeloid Leukemia (AML): a Covariate Analysis With the Tablets Formulation and Evaluation of the Potential Risk of Hepatotoxicity,https://clinicaltrials.gov/study/NCT03796533,UNKNOWN,"Among its authorized indications, posaconazole (PCZ) is prescribed for prophylaxis in onco-hematology patients at high risk of invasive fungal infections. This azole antifungal has a low bioavailability. The enteric-coated tablets form available since mid-2015 has significantly improved its pharmacokinetic profile compared to the oral suspension form initially used. According to the recommendations of The European Conference on Infections in Leukemia (ECIL-6), the minimum serum concentration desirable for prophylaxis is 0.7 mg/L. This concentration threshold was difficult to achieve in onco-hematology patients treated with oral suspension.

The investigators retrospectively collected and analyzed 201 results of residual PCZ serum concentrations from 91 onco-hematology patients on Noxafil® tablets prophylaxis. The median concentration of PCZ was 1.08 mg/L. In this study, the pharmacokinetics of tablet-PCZ showed significant inter-individual variability. Thus, while 25% of the concentrations remained below the recommended threshold of 0.7 mg/L (25% percentile = 0.69 mg/L), exposure to PCZ was greater than 2.63 mg/L in 10% of cases. This level of exposure, however, did not have obvious hepatic repercussions. Nevertheless, further studies involving larger cohorts are needed to clarify a hypothetical relationship between serum PCZ concentration and the occurrence of hepatic toxicity.

In addition, the investigators found significant intra-individual variability in PCZ exposure (CV = 48.8%), especially in leukemic patients. This variability is probably related to a modification during the treatment of the physio-pathological conditions of the patient likely to impact the pharmacokinetics of PCZ (absorption, distribution, metabolism, etc.) as well as the effect of possible pharmacokinetic drug interactions.

The metabolism of PCZ is mediated primarily by the uridine diphosphate (UDP)-glucuronosyltransferase 1A4 (UGT1A4) pathway. Although hepatic metabolism of PCZ is low compared with other azoles (such as itraconazole or voriconazole), differences in the metabolic capacity of UGT1A4 may alter PCZ exposure. A previous study of the oral suspension form had shown that low concentrations of PCZ were associated with a high ratio of PCZ-glucuronide / PCZ concentrations. Two genetic variants of the gene encoding UGT1A4 are associated with a decrease in the metabolic clearance of glucuronide drugs via UGT1A4. A recent study suggests less exposure to PCZ in the presence of UGT1A4 polymorphism.

The main objective of the investigator's project is to study prospectively in a homogeneous population of patients treated by intensive chemotherapy for acute myeloid leukemia (induction and consolidation) the pharmacokinetics of PCZ administered in its tablet formulation, and in particular:

* Clinical and biological tolerance of high concentrations of PCZ
* The influence of clinical and demographic covariates on PCZ and PCZ-glucuronide ratio
* The influence of genetic variants of UGT1A4 on PCZ metabolism (PCZ-glucuronide / PCZ ratio).",NO,"Leukemia, Myeloid, Acute",DRUG: Posaconazole,"Evolution of the blood concentration of posaconazole and its metabolite from the beginning of treatment to the end of the induction phase (pharmacokinetic)., Posaconazole (PCZ) treatment will start at Day 1 at the beginning of induction/ consolidation therapy.

* For the pharmacokinetics study of PCZ during induction, blood samples (5 mL) will be taken on days 3, 7, 14 and 21. Predoses (just prior to a daily dose) or trough concentrations (C0) will be collected on days 3, 7, 14 and 21. A peak concentration (at 3 hours post dose) will also be collected on day 14.
* After achieving complete remission, patients receive a consolidation cure. During the consolidation cures, trough concentrations will be collected on days 3, 7, 14 and 21. A peak concentration (at 3 hours post dose) will also be collected on day 14., Day 21","Search and identification by sequencing gene variants of UGT1A4, The blood sample (5 mL) for the study of polymorphisms of the UGT1A4 gene will be performed before the initiation of induction., At diagnosis",,"ADULT, OLDER_ADULT",,INTERVENTIONAL,Allocation: NA|Intervention Model: SINGLE_GROUP|Masking: NONE|Primary Purpose: HEALTH_SERVICES_RESEARCH,2018-12-10,2023-04-10,2023-04-10,"Centre Hospitalier Lyon Sud, Hematology department, Pierre-Bénite, France",1
