term,Study Title,Study URL,Study Status,Brief Summary,Study Results,Conditions,Interventions,Primary Outcome Measures,Secondary Outcome Measures,Other Outcome Measures,Age,Phases,Study Type,Study Design,Start Date,Primary Completion Date,Completion Date,Locations,results
NCT04752163,"DS-1594b With or Without Azacitidine, Venetoclax, or Mini-HCVD for the Treatment of Relapsed or Refractory Acute Myeloid Leukemia or Acute Lymphoblastic Leukemia",https://clinicaltrials.gov/study/NCT04752163,COMPLETED,"This phase I/II trial studies the effect of DS-1594b with or without azacitidine, venetoclax, or mini-HCVD in treating patients with acute myeloid leukemia or acute lymphoblastic leukemia that has come back (recurrent) or not responded to treatment (refractory). Chemotherapy drugs, such as azacitidine, venetoclax, and mini-HCVD, work in different ways to stop the growth of cancer cells, either by killing the cells, by stopping them from dividing, or by stopping them from spreading. DS-1594b may inhibit specific protein bindings that cause blood cancer. Giving DS-1594b, azacitidine, and venetoclax, or mini-HCVD may work better in treating patients with acute myeloid leukemia or acute lymphoblastic leukemia.",NO,Hematopoietic and Lymphoid Cell Neoplasm|Recurrent Acute Lymphoblastic Leukemia|Recurrent Acute Myeloid Leukemia|Recurrent Chronic Myelomonocytic Leukemia|Recurrent Myelodysplastic Syndrome|Refractory Acute Lymphoblastic Leukemia|Refractory Acute Myeloid Leukemia|Refractory Chronic Myelomonocytic Leukemia|Refractory Myelodysplastic Syndrome,DRUG: DS-1594b|DRUG: Azacitidine|DRUG: Cyclophosphamide|DRUG: Cytarabine|DRUG: Dexamethasone|BIOLOGICAL: Filgrastim|DRUG: Leucovorin|DRUG: Mesna|DRUG: Methotrexate|DRUG: Posaconazole|DRUG: Prednisone|BIOLOGICAL: Rituximab|DRUG: Venetoclax|DRUG: Vincristine|DRUG: Voriconazole,"Maximum tolerated dose (MTD) (Phase I), Day 28|Recommended phase 2 dose (RP2D) (Phase I), Day 28|Incidence of adverse events (Phase I), Measured by Common Terminology Criteria for Adverse Events (CTCAE) version 5.0., up to 30 days after discontinuation of study medication|Complete remission (CR) and complete remission with partial hematologic recover (CRh) rate with DS-1594b monotherapy in recurrent/refractory (R/R) acute myeloid leukemia (AML) with mixed-lineage leukemia rearrangement (MLLr) (Phase II, Cohort A), 3 months|CR/CRh rate with DS-1594b monotherapy in R/R AML with nucleophosmin 1 mutation (NPM1m) (Phase II, Cohort B), 3 months|CR+CRh rate of DS1594b in combination with azacitidine and venetoclax in R/R MLLr or R/R NPM1m AML (Phase II, Cohort C), 3 months|CR+CRh rate of DS1594b in combination with mini-HCVD in R/R ALL with MLLr (Phase II, Cohort D), 3 months|CR+ complete remission with incomplete hematologic recovery (CRi) rate of DS-1594b in combination with mini-HCVD in R/R ALL with MLLr, 3 months","Composite CR (CRc) rate, Defined as CR + complete remission with incomplete blood count recovery (CRi), morphologic leukemia free survival (MLFS), partial remission (PR), and overall response rate of subjects with R/R AML and R/R ALL treated on single-agent or combinations of DS-1594b., Up to 2 years|MLFS rate, Up to 2 years|PR rate, Up to 2 years|Overall response rate (ORR), Defined as CR + CRi + MLFS + PR., Up to 2 years|Duration of response, Estimated using the Kaplan-Meier method., Up to 2 years|Time to first response and time to best response, Estimated using the Kaplan-Meier method., Up to 2 years|Rate of durable transfusion independence (TI), Up to 2 years|Event-free survival, Estimated using the Kaplan-Meier method. From the date of start treatment to the date of disease relapse or date of death whichever occurs first, or to the date of last follow-up for patients who are alive and have no relapsed disease at the time of data collection, up to 1 year, 4 months|Overall survival, Estimated using the Kaplan-Meier method.From the date of the treatment start to the date of death or to the date of last follow-up if patients are alive at the time of data collection, up to 1 year, 4 months|Mortality rate, 4 weeks|Mortality rate, 8 weeks|Number of subjects able to proceed to hematopoietic stem cell transplantation (HSCT) without additional AML therapy, Up to 2 years|Median duration to HSCT from the initiation of single-agent or combinations of DS-1594b in subjects with RR AML and R/R ALL, Up to 2 years",,"ADULT, OLDER_ADULT",PHASE1|PHASE2,INTERVENTIONAL,Allocation: NON_RANDOMIZED|Intervention Model: PARALLEL|Masking: NONE|Primary Purpose: TREATMENT,2021-03-25,2023-11-08,2023-11-08,"M D Anderson Cancer Center, Houston, Texas, 77030, United States",1
NCT04645199,National Longitudinal Cohort of Hematological Diseases,https://clinicaltrials.gov/study/NCT04645199,RECRUITING,"Background Hematological diseases are disorders of the blood and hematopoietic organs. The current hematological cohorts are mostly based on single-center or multi-center cases, or cohorts with limited sample size in China. There is a lack of comprehensive and large-scale prospective cohort studies in hematology. The purpose of this study is to analyze the incidence and risk factors of major blood diseases, the treatment methods, prognosis and medical expenses of these patients in China.

Method The study will include patients diagnosed with acute myeloid leukemia, multiple myeloma, hemophilia, aplastic anemia, leukemia, myelodysplastic syndrome, lymphoma, bleeding disorders, blood infection or received bone marrow transplantation in the investigating hospitals from January 1, 2020, and collect basic information, diagnostic and treatment information, prognosis information, as well as medical expense information from medical records. In its current form, the NICHE registry incorporates historical data (collected from 2000) and is systematically collecting prospective data in two phases with broadening reach, and prospectively follow-up to collect the prognosis information.",NO,"Multiple Myeloma|Myeloma, Multiple|Myelomas, Multiple|Acute Myeloid Leukemia|Leukemias, Acute Myeloid|Myeloid Leukemias, Acute|Hemophilia|Hemophilia A|Hemophilia As|Hemophilia B|Hemophilia Bs|Myelodysplastic Syndrome|MDS|Lymphoma|Leukemia|Aplastic Anemia|Bleeding Disorder|Bone Marrow Transplantation|Blood Disease Infection",,"Incidence and distribution, To describe the incidence and population characteristics of hematological diseases in China, such as: leukemia, multiple myeloma, hemophilia, aplastic anemia, myelodysplastic syndrome, lymphoma, bleeding disorders, blood disease infection, et al., and analyze the risk factors associated with these diseases., 5 years","Therapeutic evaluation, To analyze the therapeutic efficacy and long-term prognosis of patients with hematological diseases, such as: leukemia, multiple myeloma, hemophilia, aplastic anemia, myelodysplastic syndrome, lymphoma, bleeding disorders, blood disease infection, et al., 5 years|Health economic evaluation, To conduct health economic evaluation on patients with hematological diseases, such as: leukemia, multiple myeloma, hemophilia, aplastic anemia, myelodysplastic syndrome, lymphoma, bleeding disorders, blood disease infection, et al., 5 years",,"CHILD, ADULT, OLDER_ADULT",,OBSERVATIONAL,Observational Model: |Time Perspective: p,2020-12-01,2025-12-01,2030-12-01,"Institute of Hematology & Blood Diseases Hospital, Tianjin, Tianjin, 300000, China",10
NCT04240002,"A Study of Gilteritinib (ASP2215) Combined With Chemotherapy in Children, Adolescents and Young Adults With FMS-like Tyrosine Kinase 3 (FLT3)/Internal Tandem Duplication (ITD) Positive Relapsed or Refractory Acute Myeloid Leukemia (AML)",https://clinicaltrials.gov/study/NCT04240002,RECRUITING,"The purpose of the phase 1 portion (dose escalation) of the study will be to establish an optimally safe and biologically active recommended phase 2 dose (RP2D) and/or to determine maximum tolerated dose (MTD) for gilteritinib in sequential combination with fludarabine, cytarabine and granulocyte colony-stimulating factor (FLAG). The purpose of the phase 2 portion (dose expansion) is to determine complete remission (CR) rates and composite complete remission (CRc) rates after two cycles of therapy. The study will also assess safety, tolerability and toxicities of gilteritinib in combination with FLAG, evaluate FLT3 inhibition, assess pharmacokinetics (PK), perform serial measurements of minimal residual disease, obtain preliminary estimates of 1-year event free survival (EFS) and overall survival (OS) rate and assess the acceptability as well as palatability of the formulation.

One cycle is defined as 28 days of treatment. A participant completing 1 or 2 treatment cycles in phase 1 or 2 will have the option to participate in long term treatment (LTT) with gilteritinib (for up to 2 years).",NO,Acute Myeloid Leukemia (AML)|Acute Myeloid Leukemia With FMS-like Tyrosine Kinase 3 (FLT3) Mutation / Internal Tandem Duplication (ITD),DRUG: gilteritinib|DRUG: fludarabine|DRUG: cytarabine|DRUG: granulocyte colony-stimulating factor (G-CSF),"Number of participants with dose limiting toxicity (DLT) (phase 1/dose escalation), DLT is defined as any of the events meeting the DLT criteria that occur during DLT observation period \& that is considered to be possibly or probably related to protocol therapy. Nonhematologic (NH) DLT will be defined as grade 3 NH toxicity at least possibly related to protocol therapy that persists for \>48 hours without resolution to grade ≤ 2 or 4 NH toxicity, regardless of duration, at least possibly related to protocol therapy. Hy's law or treatment-related deaths will be considered as a DLT. Gilteritinib dosing will be interrupted if NH DLT occurs. Exceptions include toxicities commonly seen with intensive AML reinduction regimens. Hematologic DLT will be defined as failure to recover a peripheral absolute neutrophil count (ANC) \>500/μL \& non-transfusion dependent platelet count \>20000/μL due to documented bone marrow aplasia/hypoplasia at day 42 from start of cycle 1 day 1. Failure to recover peripheral counts due to disease involvement of bone marrow will not be considered DLT, Up to 28 days|Complete Remission (CR) rate after 2 cycles of therapy (phase 2), CR rate is defined as the number of participants who achieve the best response of CR divided by the number of participants in the analysis population. Complete remission is defined as having bone marrow regenerating normal hematopoietic cells and achieving a morphologic leukemia-free state and must have an absolute neutrophil count (ANC) ≥ 1 x 10\^9/L and platelet count ≥ 100 x 10\^9/L and normal marrow differential with \< 5% blasts, and they will be red blood cell (RBC) and platelet transfusion independent (defined as 1 week without RBC transfusion and 1 week without platelet transfusion). There should be no evidence of extramedullary leukemia., Up to 56 days|Composite complete remission (CRc) rate after 2 cycles of therapy (phase 2), CRc rate is defined as the number of participants who achieve the best response of CRc (CR, CRp,or CRi) divided by the number of participants in the analysis population. Complete remission with incomplete platelet recovery (CRp) is defined as achieving CR except for incomplete platelet recovery (\< 100 x 10\^9/L) at a post baseline visit. Complete remission with incomplete hematologic recovery (CRi) is defined as achieving CR except for incomplete hematological recovery with residual neutropenia \< 1 x 10\^9/L with or without complete platelet recovery at a post baseline visit. Red blood cell (RBC) and platelet transfusion independence is not required., Up to 56 days","Number of participants with Adverse Events (AEs), An AE is any untoward medical occurrence in a participant administered a study drug, and which does not necessarily have to have a causal relationship with this treatment. An AE can therefore be any unfavorable and unintended sign (including an abnormal laboratory finding), symptom, or disease (new or exacerbated) temporally associated with the use of a medicinal product whether or not considered related to the medicinal product., Up to 2 years plus 28 day follow up|Number of participants with vital sign abnormalities and /or adverse events (AEs), Number of participants with potentially clinically significant vital sign values., Up to 2 years|Number of participants with laboratory value abnormalities and/or adverse events (AEs), Number of participants with potentially clinically significant laboratory values., Up to 2 years|Number of participants with electrocardiogram (ECG) abnormalities and/or adverse events (AEs), Number of participants with potentially clinically significant ECG values., Up to 2 years|Percentage of inhibition of phosphorylated FLT3 in participants., Inhibition of FLT3 phosphorylation after drug treatment will be determined relative to pre-treatment phosphorylated FLT3 levels in participants to assess the relationship with gilteritinib dose. Phosphorylated FLT3 will be measured by plasma inhibitory activity (PIA) assay., Up to 49 days|Pharmacokinetics (PK) of gilteritinib: oral clearance (CL/F), CL/F will be reported from the PK plasma samples collected., Up to 45 days|PK of gilteritinib: apparent volume of distribution (Vd/F), Vd/F will be reported from the PK plasma samples collected., Up to 45 days|PK of gilteritinib: Maximum Concentration (Cmax), Cmax will be reported from the PK plasma samples collected., Up to 45 days|PK of gilteritinib: Time of Maximum Concentration (tmax), tmax will be reported from the PK plasma samples collected., Up to 45 days|PK of gilteritinib: Area Under the Concentration (AUC), AUC will be reported from the PK plasma samples collected., Up to 45 days|Duration of Event Free Survival (EFS), EFS is defined as the time from the date of enrollment until the date of documented relapse (excluding relapse after PR), treatment failure or death, whichever occurs first. If a participant experiences relapse or death, the participant is defined as having EFS event related to either ""relapse"" or ""death"", and the event date is the date of relapse or death. If a participant fails to achieve any of the response of CR, CRp, CRi or PR during the treatment period, the participant is defined as having EFS event related to treatment failure, and the event date is the enrollment date. For a participant who is not known to have had a relapse or treatment failure or death event, EFS is censored at the date of last relapse-free disease assessment. Participant is not censored at hematopoietic stem cell transplant (HSCT)., Up to 2 years|Duration of Overall survival (OS), OS is defined as the time from the date of enrollment until the date of death from any cause. For a participant who is not known to have died by the end-of-study follow-up, OS is censored at the date of last contact., Up to 4 years and 2 months|The number of participants with negative minimal residual disease (MRD) status, MRD negative status will be defined as FLT3-internal tandem duplication (ITD) signal ratio ≤ 10\^-4., Up to 2 years|Number of participants with MRD negative status in relation to CR rate, MRD negative status will be defined as FLT3-internal tandem duplication (ITD) signal ratio ≤ 10\^-4., Up to 2 years|Number of participants with MRD negative status in relation to CRc rate, MRD negative status will be defined as FLT3-internal tandem duplication (ITD) signal ratio ≤ 10\^-4., Up to 2 years|Number of participants with MRD negative status in relation to Overall survival (OS), MRD negative status will be defined as FLT3-internal tandem duplication (ITD) signal ratio ≤ 10\^-4., Up to 2 years|Clinical Outcome Assessment of Taste, The acceptability and palatability of gilteritinib oral formulation as assessed by the participant using a single scale. The 5 point facial hedonic scale has high to low as: Liked it Very Much, Liked it a Little, Not sure, Disliked it a Little, Disliked it Very Much., Up to 57 days",,"CHILD, ADULT",PHASE1|PHASE2,INTERVENTIONAL,Allocation: NON_RANDOMIZED|Intervention Model: SEQUENTIAL|Masking: NONE|Primary Purpose: TREATMENT,2020-09-04,2027-08-31,2031-08-31,"Cincinnati Children's Hospital Medical Center, Cincinnati, Ohio, 45229, United States|The Children's Hospital of Philadelphia (CHOP), Philadelphia, Pennsylvania, 19104, United States|St. Jude Children's Research Hospital, Memphis, Tennessee, 38105, United States|Sarah Cannon Research Institute, Nashville, Tennessee, 37203, United States|Site CA15001, Montreal, Quebec, H3T 1C5, Canada|Site FR33003, Bordeaux, France|Site FR33004, Marseille cedex 05, France|Site FR33005, Paris, France|Site FR33006, Paris, France|Site FR33002, Vandoeuvre-Lès-Nancy, France|Site DE49002, Freiburg, Baden-Württemberg, 79106, Germany|Site DE49003, Regensburg, Bayern, 93053, Germany|Site DE49004, Essen, Nordrhein-Westfalen, 45147, Germany|Site DE49001, Halle (Saale), Sachsen-Anhalt, 06120, Germany|Site IT39003, Bologna, 40138, Italy|Site IT39002, Monza, 20900, Italy|SIte IT39001, Roma, 165, Italy|Site ES34001, Barcelona, 08950, Spain|Site ES34002, Barcelona, 08950, Spain|Site ES34003, Sevilla, 41013, Spain|Site GB44001, Birmingham, B4 6NH, United Kingdom|Site GB44006, Bristol, BS2 8BJ, United Kingdom|Site GB44005, Cardiff, CF14 4XW, United Kingdom|Site GB44003, Glasgow, G51 4TF, United Kingdom|Site UK44007, Sutton, United Kingdom",1
NCT04140487,"Azacitidine, Venetoclax, and Gilteritinib in Treating Patients With Recurrent/Refractory FLT3-Mutated Acute Myeloid Leukemia, Chronic Myelomonocytic Leukemia, or High-Risk Myelodysplastic Syndrome/Myeloproliferative Neoplasm",https://clinicaltrials.gov/study/NCT04140487,RECRUITING,"This phase I/II trial studies the side effects and best dose of gilteritinib and to see how well it works in combination with azacitidine and venetoclax in treating patients with FLT3-mutation positive acute myeloid leukemia, chronic myelomonocytic leukemia, or high-risk myelodysplastic syndrome/myeloproliferative neoplasm that has come back (recurrent) or has not responded to treatment (refractory). Drugs used in chemotherapy, such as azacitidine, work in different ways to stop the growth of cancer cells, either by killing the cells, by stopping them from dividing, or by stopping them from spreading. Venetoclax may stop the growth of cancer cells by blocking Bcl-2, a protein needed for cancer cell survival. Gilteritinib may stop the growth of cancer cells by blocking some of the enzymes needed for cell growth. Giving azacitidine, venetoclax, and gilteritinib may work better compared to azacitidine and venetoclax alone in treating patients with acute myeloid leukemia, chronic myelomonocytic leukemia, or myelodysplastic syndrome/myeloproliferative neoplasm.",NO,Recurrent Acute Myeloid Leukemia|Recurrent Chronic Myelomonocytic Leukemia|Recurrent Myelodysplastic/Myeloproliferative Neoplasm|Refractory Acute Myeloid Leukemia|Refractory Chronic Myelomonocytic Leukemia|Refractory Myelodysplastic/Myeloproliferative Neoplasm,DRUG: Azacitidine|DRUG: Gilteritinib|DRUG: Venetoclax,"Maximum-tolerated dose (MTD) of gilteritinib (Phase I), The MTD is the highest dose level in which \< 2 patients of 6 develop first cycle dose-limiting toxicity., Up to 28 days|Overall response rate (OR) (Phase II), Will be defined as the complete remission/complete remission with incomplete count recovery (CR/CRi) rate. Will estimate the OR for the combination treatment along with the 95% credible interval., Up to 56 days (2 cycles)","Complete response rate, Will be estimated along with 95% credible interval., Up to 3 years|Minimal residual disease negativity, Will be assessed by flow cytometry and estimated along with 95% credible interval., Up to 3 years|Relapse-free survival, Will be estimated using the method of Kaplan and Meier., The number of days from the date of response to the date of documented relapses from CR or death from any cause, whichever occurs first, assessed up to 3 years|Overall survival, Will be estimated using the method of Kaplan and Meier., From the start of treatment until death or last follow-up, assessed for up to 3 years|Proportion of patients proceeding to hematopoietic stem cell transplantation, Will be estimated along with 95% credible interval., Up to 3 years|Incidence of adverse events, Will be summarized using descriptive statistics such as mean, standard deviation, median and range., Up to 3 years","Impact of genomic alterations, The impact of genomic alterations on response and the survival of the combination regimen will be assessed. Will be examined by Wilcoxon's rank sum test or Fisher's exact test, as appropriate., Baseline|Impact of FLT3 allelic ratio, The impact of FLT3 allelic ratio on response and the survival will be assessed. Will be examined by Wilcoxon's rank sum test or Fisher's exact test, as appropriate., Baseline|Minimal residual disease negativity rates, Will be assessed by digital droplet polymerase chain reaction. Will be examined by Wilcoxon's rank sum test or Fisher's exact test, as appropriate., At time of remission|Evaluation of leukemia stem cell populations, Will be examined by Wilcoxon's rank sum test or Fisher's exact test, as appropriate., Up to 3 years","ADULT, OLDER_ADULT",PHASE1|PHASE2,INTERVENTIONAL,Allocation: NA|Intervention Model: SINGLE_GROUP|Masking: NONE|Primary Purpose: TREATMENT,2019-12-17,2025-09-01,2025-09-01,"M D Anderson Cancer Center, Houston, Texas, 77030, United States",1
