term,Study Title,Study URL,Study Status,Brief Summary,Study Results,Conditions,Interventions,Primary Outcome Measures,Secondary Outcome Measures,Other Outcome Measures,Age,Phases,Study Type,Study Design,Start Date,Primary Completion Date,Completion Date,Locations,results
NCT04067336,First in Human Study of Ziftomenib in Relapsed or Refractory Acute Myeloid Leukemia,https://clinicaltrials.gov/study/NCT04067336,RECRUITING,"This first-in-human (FIH) dose-escalation and dose-validation/expansion study will assess ziftomenib, a menin-MLL(KMT2A) inhibitor, in patients with relapsed or refractory acute myeloid leukemia (AML) as part of Phase 1. In Phase 2, assessment of ziftomenib will continue in patients with NPM1-m AML.",NO,Advanced Malignant Neoplasm|Acute Myeloid Leukemia|Mixed Lineage Leukemia|Mixed Lineage Acute Leukemia|Acute Leukemia of Ambiguous Lineage|Mixed Phenotype Acute Leukemia,DRUG: Ziftomenib,"Phase 1a: Maximal tolerated dose (MTD) and/or the recommended Phase 2 dose (RP2D), MTD is defined as the highest dose that is not expected to cause dose limiting toxicity (DLT) in more than 20% of patients., Dose Limiting Toxicities (DLTs) will be evaluated during the first 28 days (1 cycle)|Phase 1b: Number of patients that experience Adverse Events (AEs) and Serious Adverse Events (SAEs)., Assessed by NCI-CTCAE v5.0, During treatment and up to approximately 28 days after treatment discontinuation, or until immediately before the initiation of another anticancer therapy, whichever occurs first.|Phase 1b: Minimal biologically effective dose, Minimal biologically effective dose in dosing cohorts which have demonstrated biological activity and have been determined to be safe as a part of Part 1a, Up to 12 months following end of treatment|Phase 2: Evidence of anti-leukemia activity, Anti-leukemia activity is assessed by the CR (CR+CRh) rate, 12 months following end of treatment","Phase 1a: Number of patients that experience Adverse Events (AEs) and Serious Adverse Events (SAEs)., Assessed by NCI-CTCAE v5.0, During treatment and up to approximately 28 days after treatment discontinuation, or until immediately before the initiation of another anticancer therapy, whichever occurs first.|Phase 1a: Tmax, Time to observed maximum plasma concentration of ziftomenib and/or its metabolites, Cycle 1 and Cycle 2. Each cycle is 28 days.|Phase 1a: AUC(0-last), Area under the plasma concentration-time curve from time 0 to time of last measurable concentration of ziftomenib and/or its metabolites, Cycle 1 and Cycle 2. Each cycle is 28 days.|Phase 1a: Cmax, Maximum plasma concentration of ziftomenib and/or its metabolites, Cycle 1 and Cycle 2. Each cycle is 28 days.|Phases 1a, 1b, and 2: Composite definition of complete remission (CR) and complete remission with partial hematologic recovery (CRh), To assess the CR (CR+CRh) rate, Up to 12 months following discontinuation of treatment|Phases 1a, 1b, and 2: Complete response (CR) with and without minimal residual disease (MRD), To assess the CR rate with and without MRD, Up to 12 months following discontinuation of treatment|Phases 1a, 1b, and 2: Duration of remission (DOR), To assess the DOR, Up to 12 months following discontinuation of treatment|Phases 1a, 1b, and 2: Transfusion independence (TI), To assess transfusion independence, Up to 12 months following discontinuation of treatment|Phases 1a, 1b, and 2: Event-free survival (EFS), To assess event-free survival, Up to 12 months following discontinuation of treatment|Phases 1a, 1b, and 2: Overall survival, To assess overall survival, Up to 12 months following discontinuation of treatment",,"ADULT, OLDER_ADULT",PHASE1|PHASE2,INTERVENTIONAL,Allocation: RANDOMIZED|Intervention Model: PARALLEL|Masking: NONE|Primary Purpose: TREATMENT,2019-09-12,2024-09-30,2025-09-30,"Banner MD Anderson Cancer Center, Gilbert, Arizona, 85234, United States|Mayo Clinic, Phoenix, Arizona, 85054, United States|University of Southern California, Los Angeles, California, 90033, United States|UCLA Bowyer Oncology Center, Los Angeles, California, 90095, United States|Mayo Clinic, Jacksonville, Florida, 32224, United States|Northwestern University, Chicago, Illinois, 60611, United States|Indiana University Melvin and Bren Simon Comprehensive Cancer Center, Indianapolis, Indiana, 46202, United States|University of Maryland Greenebaum Comprehensive Cancer Center, Baltimore, Maryland, 21201, United States|Massachusetts General Hospital, Boston, Massachusetts, 02114, United States|University of Michigan Hospitals, Ann Arbor, Michigan, 48109, United States|Karmanos Cancer Institute, Detroit, Michigan, 48201, United States|Mayo Clinic, Rochester, Minnesota, 55905, United States|Hackensack University Medical Center - John Theurer Cancer Center, Hackensack, New Jersey, 07601, United States|Roswell Park Comprehensive Cancer Center, Buffalo, New York, 14203, United States|Weill Cornell Medical College - NY Presbyterian Hospital, New York, New York, 10021, United States|The Mount Sinai Hospital, New York, New York, 10029, United States|Duke Cancer Institute, Durham, North Carolina, 27710, United States|Oklahoma University Health - Stephenson Cancer Center, Oklahoma City, Oklahoma, 73117, United States|UPMC Hillman Cancer Center, Pittsburgh, Pennsylvania, 15232, United States|Vanderbilt-Ingram Cancer Center, Nashville, Tennessee, 37232, United States|Harold C. Simmons Comprehensive Cancer Center - UT Southwestern Medical Center, Dallas, Texas, 75390, United States|MD Anderson Cancer Center, Houston, Texas, 77030, United States|Fred Hutchinson Cancer Research Center, Seattle, Washington, 98109, United States|UZ Brussel, Jette, 1090, Belgium|AZ Delta - Campus Rumbeke, Roeselare, 8800, Belgium|Queen Elizabeth II Health Sciences Centre, Halifax, Nova Scotia, B3H 1V7, Canada|Hopital Maisonneuve-Rosemont, Montréal, Quebec, H1T 2M4, Canada|Hopital de l'Enfant-Jesus - Centre Integre en Cancerologie du CHU de Quebec - Universite Laval, Québec, Quebec, G1J 1Z4, Canada|CHU de Quebec - Universite Laval, Hopital de l'Enfant - Jesus, Québec, Quebec, G1S 4L8, Canada|CHU de Lille, Lille, 59037, France|CHU de Nantes, Nantes, 44093, France|Hopital Saint Louis, Paris, 75475, France|Magendie Hopital Haut-Leveque, Pessac, 33600, France|Centre Hospitalier Lyon Sud, Pierre-Bénite, 69310, France|Institut Gustave Roussy, Villejuif, 94800, France|Charitè-Campus Benjamin Franklin, Berlin, 12203, Germany|University Medicine Greifswald, Greifswald, 17475, Germany|Medizinische Hochsschule Hannover, Hannover, Germany|Johannes Gutenberg - University Mainz, Mainz, 55131, Germany|Institute of Hematology and Medical Oncology ""L. and A. Seragnoli"", Bologna, 40138, Italy|IRCCS Istituto Romagnolo per lo Studio dei Tumori ""Dino Amadori"", Meldola, 47014, Italy|UO Ematologia Ospedale di Ravenna, Ravenna, 48121, Italy|Institution Fondazione Policlinico Tor Vergata, Roma, Italy|Hospital Universitari Vall d'Hebron, Barcelona, 08035, Spain|Universitat de Barcelona, Barcelona, 08035, Spain|MD Anderson Cancer Center, Madrid, 28033, Spain|Hospital Universitario HM Sanchinarro, Madrid, 28050, Spain|Hospital Universitario Central de Asturias, Oviedo, 33011, Spain|Hospital Universitario Virgen del Rocio, Sevilla, 41013, Spain|Hospital Universitari i Politecnic La Fe, Valencia, 46026, Spain|Beatson West of Scotland Cancer Centre, Glasgow, G12 0YN, United Kingdom|St. George's Hospital, London, SW17 0QT, United Kingdom",3
NCT05342584,Venetoclax Plus Intensive Chemotherapy in AML and Advanced MDS,https://clinicaltrials.gov/study/NCT05342584,RECRUITING,"This is a Phase 1b, open-label study evaluating Venetoclax in combination with intensive induction and consolidation chemotherapy in previously untreated, adult patients with acute myeloid leukemia. In Part 1, the dose escalation phase, the safety and tolerability of the combination with Venetoclax at different doses and duration will inform the appropriate dose(s) and regimen(s) for Part 2. In Part 2, the dose expansion phase, a maximum of 28 additional patients will be randomized 1:1 to the MTD determined in Part 1 and the starting dose (assuming the MTD is not the starting dose), to further evaluate the safety and efficacy of the study drug combination.",NO,Acute Myeloid Leukemia|Myelodysplastic Syndromes,DRUG: Venetoclax Oral Tablet|DRUG: Daunorubicin|DRUG: Cytarabine,"Frequency and severity of adverse events (AEs), To characterize the safety profile (incidence of AEs) and dose-limiting toxicities (DLTs) of Venetoclax in combination with Daunorubicin and Cytarabine, Through study completion, up to 6 years|Maximum tolerated dose of Venetoclax in combination with Daunorubicin and Cytarabine, To determine a safe and tolerable dose of Venetoclax in combination with Daunorubicin and Cytarabine during induction, Through study completion, up to 6 years|Maximum tolerated dose of Venetoclax in combination with high dose cytarabine, To determine a safe and tolerable dose of Venetoclax in combination high dose of Cytarabine during consolidation, Through study completion, up to 6 years","Overall response rate (ORR), Defined as complete response (CR) + CR with incomplete blood count recovery (CRi) + partial response (PR). Will be estimated along with the 95% credible interval., Through study completion, up to 6 years|Hematologic response rate, Will be estimated along with the 95% credible interval, Through study completion, up to 6 years|Duration of response, Defined as the number of days from the date of initial response (CRi or better) to the date of first documented disease progression/relapse or death, whichever occurs first. Will be calculated for all patients., From the date of initial response, assessed up to 6 years|Overall survival, Estimated using Kaplan-Meier method. Log-rank tests will be used to compare among subgroups of patients., Through study completion, up to 6 years|Event-free survival, Defined as the number of days from the date of treatment initiation (i.e., course 1 day 1) to the date of documented treatment failure, relapses from CR, or death from any cause, whichever occurs first. Will be calculated for all patients. Estimated using Kaplan-Meier method. Log-rank tests will be used to compare among subgroups of patients., Through study completion, up to 6 years|Morphologic leukemia-free state, Will be estimated along with the 95% credible interval., Through study completion, up to 6 years","Rate of LSC eradication (exploratory objective), The depth of remission will be evaluated with exploratory analyses of LSC MRD negativity by flow cytometry and single cell sequencing., Through study completion, up to 6 years","ADULT, OLDER_ADULT",PHASE1,INTERVENTIONAL,Allocation: NA|Intervention Model: SINGLE_GROUP|Masking: NONE|Primary Purpose: TREATMENT,2022-05-25,2028-12,2028-12,"Montefiore Einstein Cancer Center, Bronx, New York, 10467, United States",1
NCT04260022,Study of HQP1351 in Subjects With Refractory CML and Ph+ ALL,https://clinicaltrials.gov/study/NCT04260022,RECRUITING,"A multi-center, open-label, randomized, phase Ib study to evaluate the pharmacokinetics (PK) of HQP1351 and to determine the recommended phase 2 dose (RP2D) of HQP1351 in subjects with CML chronic phase (CP), accelerated phase (AP), or blast phase (BP) or with Ph+ ALL, who have experienced resistance or intolerance to at least two tyrosine kinase inhibitors (TKIs) or in subjects with Ph+ B-cell precursor (BCP) ALL or lymphoid blast phase CML (CML LBP), who have experienced resistance or intolerance to at least one second or later generation TKI.",NO,"Leukemia, Myeloid, Chronic|Myeloid Leukemia|Chronic Myeloid Leukemia|Philadelphia Positive Acute Lymphoblastic Leukemia|B Cell Precursor Type Acute Leukemia",DRUG: Ascentage Pharma HQP1351 bioavailable inhibitor|DRUG: Blinatumomab,"Maximum Plasma Concentration (Cmax) of HQP1351, To evaluate the Maximum Plasma Concentration (Cmax) of HQP1351, 28 days|Area Under the Curve (AUC) of HQP1351, To evaluate the Area Under the Curve (AUC) of HQP1351, 28 days",,,"ADULT, OLDER_ADULT",PHASE1,INTERVENTIONAL,Allocation: RANDOMIZED|Intervention Model: PARALLEL|Masking: NONE|Primary Purpose: TREATMENT,2020-01-09,2024-01-31,2024-01-31,"University of Alabama at Birmingham, Birmingham, Alabama, 35294, United States|Highlands Oncology, Rogers, Arkansas, 72758, United States|City of Hope, Duarte, California, 91010, United States|Winship Cancer Institute, Emory University, Atlanta, Georgia, 30322, United States|University of Maryland, Baltimore, Maryland, 21201, United States|Cleveland Clinic, Cleveland, Ohio, 44195, United States|University of Texas MD Anderson Cancer Center, Houston, Texas, 77030, United States|Fred Hutchinson Cancer Research Center, Seattle, Washington, 98109, United States",2
NCT04188405,"Decitabine, Venetoclax, and Ponatinib for the Treatment of Philadelphia Chromosome-Positive Acute Myeloid Leukemia or Myeloid Blast Phase or Accelerated Phase Chronic Myelogenous Leukemia",https://clinicaltrials.gov/study/NCT04188405,RECRUITING,"This phase II trial studies how well the combination of decitabine, venetoclax, and ponatinib work for the treatment of Philadelphia chromosome-positive acute myeloid leukemia or myeloid blast phase or accelerated phase chronic myelogenous leukemia. Drugs used in chemotherapy such as decitabine, work in different ways to stop the growth of cancer cells, either by killing the cells, by stopping them from dividing, or by stopping them from spreading. Venetoclax may stop the growth of cancer cells by blocking Bcl-2, a protein needed for cancer cell survival. Ponatinib may stop the growth of cancer cells by blocking some of the enzymes needed for cell growth. Giving decitabine, venetoclax, and ponatinib may help to control Philadelphia chromosome-positive acute myeloid leukemia or myeloid blast phase or accelerated phase chronic myelogenous leukemia.",NO,"Accelerated Phase Chronic Myelogenous Leukemia, BCR-ABL1 Positive|Acute Myeloid Leukemia|Blast Phase Chronic Myelogenous Leukemia, BCR-ABL1 Positive|Recurrent Acute Myeloid Leukemia|Recurrent Chronic Myelogenous Leukemia, BCR-ABL1 Positive|Refractory Acute Myeloid Leukemia|Refractory Chronic Myelogenous Leukemia, BCR-ABL1 Positive",DRUG: Decitabine|DRUG: Ponatinib|DRUG: Venetoclax,"Overall response rate, Defined as the proportion of patients achieving complete remission (CR) + CR with incomplete count recovery (CRi) occurring at the end of 2 cycles of treatment. Will be estimated along with the 95% credible interval. Patients who drop out of the study before completing 2 cycles and have been treated will be censored for the primary endpoint analysis., End of cycle 2 (each cycle is 28 days)","Rate of minimal residual disease negativity, Will be estimated along with the 95% credible interval., Up to 4.5 years|Proportion of patients proceeding to allogeneic stem cell transplant, Will be estimated along with the 95% credible interval., Up to 4.5 years|Relapse-free survival (RFS), The distribution of RFS will be estimated using the method of Kaplan and Meier. Comparisons by important subgroups will be made using the log-rank tests., From the date of treatment initiation to the date of documented treatment relapses from CR/CRi or death from any cause, whichever occurs first, assessed up to 4.5 years|Overall survival (OS), The distribution of OS will be estimated using the method of Kaplan and Meier. Comparisons by important subgroups will be made using the log-rank tests., From treatment start till death or last follow-up, assessed up to 4.5 years|Incidence of adverse events, Safety data will be summarized by category, severity and frequency., Up to 4.5 years","Apoptotic protein expression and Bcl-2 dependency on response and resistance, The association between response and patient's clinical information such as apoptotic protein expression, etc. will be examined by Wilcoxon's rank sum test or Fisher's exact test, as appropriate., Up to 4.5 years","ADULT, OLDER_ADULT",PHASE2,INTERVENTIONAL,Allocation: NA|Intervention Model: SINGLE_GROUP|Masking: NONE|Primary Purpose: TREATMENT,2020-05-17,2025-09-01,2025-09-01,"M D Anderson Cancer Center, Houston, Texas, 77030, United States",1
NCT03747757,Cognitive Behavioral Therapy in Helping Patients With Acute Myeloid Leukemia or Lymphoma With Cancer-Related Fatigue,https://clinicaltrials.gov/study/NCT03747757,ACTIVE_NOT_RECRUITING,"This trial studies how well cognitive behavioral therapy works in helping patients with acute myeloid leukemia or lymphoma with cancer-related fatigue. Behavioral therapy uses methods to help patients change the way they think and act. Behavioral skills may help patients with acute myeloid leukemia or lymphoma cope with anxiety, depression, and other factors that may influence their level of cancer-related fatigue.",NO,Acute Myeloid Leukemia|Acute Myeloid Leukemia Arising From Previous Myelodysplastic Syndrome|Cancer Fatigue|Lymphoma|Secondary Acute Myeloid Leukemia,BEHAVIORAL: Cognitive Behavior Therapy|OTHER: Quality-of-Life Assessment|OTHER: Questionnaire Administration,"Adherence to cognitive behavioral therapy (CBT) defined as percentage of the total completed prescribed counseling sessions (7 sessions) the study patient is able to complete, Up to 8 weeks or 6 months|Satisfaction with CBT assessed using a 5 point, fully word-anchored balanced bipolar scale (Satisfaction Assessment)., To determine if patients are satisfied with CBT, based on equal to or more than 75% of patients indicating their satisfaction with CBT with a rating of ""somewhat satisfied"" or ""completely satisfied"". Satisfaction will be assessed using a 5 point, fully word-anchored balanced bipolar scale (Satisfaction Assessment)., Up to 8 weeks","Improvement of symptoms determined by M.D. Anderson Symptom Inventory - Acute Myeloid Leukemia / Myelodysplastic Syndromes (MDASI-AML/MDS), MDASI symptom questionnaire answers range from 0 meaning ""Not Present"" to 10 meaning ""As Bad as You Can Imagine""., Baseline to 8 weeks or 6 months",,"ADULT, OLDER_ADULT",PHASE2,INTERVENTIONAL,Allocation: NA|Intervention Model: SINGLE_GROUP|Masking: NONE|Primary Purpose: SUPPORTIVE_CARE,2018-11-29,2025-09-11,2025-09-11,"M D Anderson Cancer Center, Houston, Texas, 77030, United States",1
NCT03969446,"Pembrolizumab and Decitabine With or Without Venetoclax in Treating Patients With Acute Myeloid Leukemia or Myelodysplastic Syndrome That Is Newly-Diagnosed, Recurrent, or Refractory",https://clinicaltrials.gov/study/NCT03969446,RECRUITING,"This phase Ib trial studies the side effects and best dose of pembrolizumab and how well it works in combination with decitabine with or without venetoclax in treating patients with acute myeloid leukemia or myelodysplastic syndrome that is newly-diagnosed, has come back (recurrent), or does not respond to treatment (refractory). Immunotherapy with monoclonal antibodies, such as pembrolizumab, may help the body's immune system attack the cancer, and may interfere with the ability of tumor cells to grow and spread. Decitabine is in a class of medications called hypomethylation agents. It works by helping the bone marrow produce normal blood cells and by killing abnormal cells in the bone marrow. Venetoclax is in a class of medications called B-cell lymphoma-2 (BCL-2) inhibitors. It may stop the growth of cancer cells by blocking Bcl-2, a protein needed for cancer cell survival. This trial may help doctors find the best dose of pembrolizumab that can be safely given in combination with decitabine with or without venetoclax, and to determine what side effects are seen with this treatment.",NO,Acute Myeloid Leukemia|Myelodysplastic Syndrome|Recurrent Acute Myeloid Leukemia|Recurrent Myelodysplastic Syndrome|Refractory Acute Myeloid Leukemia|Refractory Myelodysplastic Syndrome,DRUG: Decitabine|BIOLOGICAL: Pembrolizumab|DRUG: Venetoclax,"Incidence of adverse events, Will be graded according to the National Cancer Institute (NCI) Common Terminology Criteria for Adverse Events (CTCAE) version 5.0. Observed toxicities will be summarized in terms of type (organ affected or laboratory determination), severity, time of onset, duration, probable association with the study treatment and reversibility or outcome., Up to 2 years|Maximum-tolerated dose (MTD), Will be based on the assessment of dose-limiting toxicities (DLTs) during cycle 1 and NCI CTCAE version 5.0. Standard 3+3 design rules will govern enrollment and dose de-escalation. In each arm, the dose level that produces =\< 1/6 DLTs will be declared the MTD., Up to day 42|Response to treatment, Will obtain preliminary estimates of complete remission (CR)+CR with incomplete hematologic recovery (CRi). Patients will have their response classified according to modified Cheson, 2006 criteria (myelodysplastic syndrome cohort) and Dohner et al., 2017 criteria (acute myeloid leukemia cohort). Rates and 95% Clopper-Pearson binomial confidence interval will be calculated for the complete remission rate (patients that have confirmed CR/CRi). Response rates will also be explored based on number/type of prior therapy(ies)., Up to 2 years","Response duration, Will be estimated using the product-limit method of Kaplan and Meier., From date of first documented response (CR + CRi) to documented disease relapse or death whichever occurs first, assessed up to 2 years|Overall survival, Will be estimated using the product-limit method of Kaplan and Meier., From date of first dose of study drug to date of death from any cause, assessed up to 2 years|Progression-free survival, Will be estimated using the product-limit method of Kaplan and Meier., From date of first dose of study drug to first documented disease relapse/progression or death from any cause, whichever occurs first, assessed up to 2 years","Change in PD-1, PD-L1, and PD-L2 levels, Baseline up to 2 years|Change in T cell subset distribution, Baseline up to 2 years|Change in T cell receptor repertoire, Baseline up to 2 years","ADULT, OLDER_ADULT",PHASE1,INTERVENTIONAL,Allocation: NON_RANDOMIZED|Intervention Model: PARALLEL|Masking: NONE|Primary Purpose: TREATMENT,2020-05-04,2025-11-04,2025-11-04,"City of Hope Medical Center, Duarte, California, 91010, United States",1
