term,Study Title,Study URL,Study Status,Brief Summary,Study Results,Conditions,Interventions,Primary Outcome Measures,Secondary Outcome Measures,Other Outcome Measures,Age,Phases,Study Type,Study Design,Start Date,Primary Completion Date,Completion Date,Locations,results
NCT03672695,Phase I Dose Escalation Study of Intravenously Administered S64315 in Combination With Orally Administered Venetoclax in Patients With Acute Myeloid Leukaemia.,https://clinicaltrials.gov/study/NCT03672695,COMPLETED,"The purpose of this study is to determine the safety profile, tolerability and the Recommended Phase 2 Dose of the combination S64315 with venetoclax in patients with Acute Myeloid Leukaemia.",NO,Acute Myeloid Leukaemia,COMBINATION_PRODUCT: S 64315 (also referred as MIK665) and venetoclax,"Incidence of Dose Limiting Toxicity (DLTs), At the end of cycle 1 (each cycle is 21 or 28 days).|Incidence and severity of AEs, Through study completion, an average of 6 months.|Incidence and severity of SAEs, Through study completion, an average of 6 months.|Number of participants with dose interruptions ""will be measured and reported in the Outcome Measure results data table., Through study completion, an average of 6 months.|Number of participants with dose reductions ""will be measured and reported in the Outcome Measure results data table., Through study completion, an average of 6 months.|Dose intensity, Through study completion, an average of 6 months.","Anti-leukemic activity, Using blood, bone marrow aspirate and medullary biopsy if available according to ELN 2017 criteria, Through study completion, an average of 6 months.|Pharmacokinetic profile of S64315 administered in combination with Venetoclax in plasma: Area Under the Curve (AUC), From Day 1 of cycle 1 to the end of cycle 2 (each cycle is 21 or 28 days).|Pharmacokinetic profile of S64315 administered in combination with Venetoclax in plasma: Concentration at the end of infusion (Cinf), From Day 1 of cycle 1 to the end of cycle 2 (each cycle is 21 or 28 days).|Pharmacokinetic profile of S64315 administered in combination with Venetoclax in plasma: terminal half-life (t½z), From Day 1 of cycle 1 to the end of cycle 2 (each cycle is 21 or 28 days).",,"ADULT, OLDER_ADULT",PHASE1,INTERVENTIONAL,Allocation: NON_RANDOMIZED|Intervention Model: SEQUENTIAL|Masking: NONE|Primary Purpose: TREATMENT,2018-11-28,2022-11-12,2023-05-30,"Smilow Cancer Hospital at Yale, New Haven, Connecticut, 06511, United States|The University of Texas MD Anderson Cancer Center, Houston, TX, Houston, Texas, 77030, United States|Peter MacCallum cancer centrer, Melbourne, Australia|The Alfred Hospital Department of Haematology, Victoria Park, Australia|Institut Paoli-Calmettes, Marseille, France|Hopital Saint-Antoine, Paris, France|Institut Universitaire du Cancer Toulouse - Oncopole, Toulouse, France",1
NCT04172844,"Pevonedistat, Azacitidine (or Decitabine), and Venetoclax for the Treatment of Patients With Acute Myelogenous Leukemia",https://clinicaltrials.gov/study/NCT04172844,TERMINATED,This is a phase Ib study with a 3 + 3 dose escalation design followed by a dose-expansion phase.,NO,Acute Myelogenous Leukemia,DRUG: Azacitidine|DRUG: Venetoclax|DRUG: Pevonedistat,"Recommended phase 2 dose of pevonedistat when co-administered with azacitidine and venetoclax in patients with AML., The maximum-tolerated dose is defined as the highest dose level at which none of the first three treated subjects, or no more than one of the first six treated subjects, experiences a dose-limiting toxicity., Up to 28 days (one cycle) for each dosing cohort.|The toxicity profile of pevonedistat, azacitidine, and venetoclax combination therapy., The number of serious adverse events will be measured using NCI-CTCAE v5 criteria., Up to 30 days after last dose of study drugs.","Complete Remission Rate, The number of subjects who achieve complete remission. Complete remission is defined as follows: Bone marrow blasts \<5 percent; absence of blasts with Auer rods; absence of extramedullary disease; absolute neutrophil count \>1.0 x 10\^9/L (1000/μL); platelet count \>100 x 10\^9/L (100,000/μL); independence of red cell transfusions., Up to five years.|Complete Remission with Partial Hematological Recovery, The number of subjects who achieve complete remission with partial hematological recovery. Complete Remission with Partial Hematological Recovery is defined as:

Complete remission with partial hematological recovery (CRh) defined as:

* \<5% blasts in the bone marrow.
* No evidence of disease.
* Partial recovery of peripheral blood counts.
* Platelets \>50,000/microliter and absolute neutrophil counts \>500/microliter., Up to five years.|Partial Remission Marrow, The number of subjects who achieve partial remission marrow. Partial Remission Marrow is defined as: Decrease of bone marrow blast percentage to 5 to 15%; and decrease of pretreatment bone marrow blast percentage by at least 50%., Up to five years.|Morphologic Leukemia Free State, The number of patients who achieve morphologic leukemia free state. Morphologic Leukemia Free State is defined as: Bone marrow blasts \<5%; absence of blasts with Auer rods; absence of extramedullary disease; no hematologic recovery required., Up to five years.|Complete Remission without Minimal Residual Disease, The number of patients who achieve CR without minimal residual disease. Complete Remission without Minimal Residual Disease is defined as: CR with negativity for a genetic marker by reverse transcriptase polymerase chain reaction (RT-qPCR), or CR with negativity by MFC., Up to five years.",,"ADULT, OLDER_ADULT",PHASE1,INTERVENTIONAL,Allocation: NON_RANDOMIZED|Intervention Model: SEQUENTIAL|Masking: NONE|Primary Purpose: TREATMENT,2020-01-13,2021-12-12,2022-02-27,"Mayo Clinic, Rochester, Minnesota, 55905, United States|Froedtert Hospital and the Medical College of Wisconsin, Milwaukee, Wisconsin, 53226, United States",1
NCT03904251,CPX-351 and Gemtuzumab Ozogamicin in Treating Patients With Relapsed Acute Myeloid Leukemia,https://clinicaltrials.gov/study/NCT03904251,TERMINATED,"This phase Ib trial studies the best dose of gemtuzumab ozogamicin when given together with CPX-351 in treating patients with acute myeloid leukemia that has come back after it was previously in remission. CPX-351 is a chemotherapy, which works in different ways to stop the growth of cancer cells, either by killing the cells, by stopping them from dividing, or by stopping them from spreading. Gemtuzumab ozogamicin is a monoclonal antibody, called gemtuzumab, linked to chemotherapy called calicheamicin. Gemtuzumab attaches to CD33 (transmembrane receptor) positive cancer cells in a targeted way and delivers ozogamicin to kill them. Giving CPX-351 and gemtuzumab ozogamicin may work better in treating patients with acute myeloid leukemia, compared to giving only one of these therapies alone.",NO,Acute Myelogenous Leukemia,DRUG: Gemtuzumab Ozogamicin|DRUG: Liposome-encapsulated Daunorubicin-Cytarabine,"Maximum tolerated dose (MTD), MTD is defined as the cohort of participants one cohort below the cohort that develop dose-limiting toxicity (DLT) in at least 2 participants., Up to day 42","Objective response rate (ORR), Objective response, including complete remission (CR) plus complete remission with incomplete hematologic recovery (CRi), after induction therapy will be measured using the International Working Group (IWG) Response Criteria in acute myeloid leukemia (AML)., Up to day 42|Proportion of participants who go on to receive allogeneic hematopoietic cell transplantation (HSCT) after achieving CR/CRi, The proportion of patients who receive an allogeneic HSCT following a CR/CRi response will be reported along with an exact 95% confidence interval., Up to 18 months|Duration of remission, Evaluated in participants that achieve CR/CRi, and defined as number of days that elapse from first day CR/CRi to the first day that bone marrow blasts \>= 5%. The median duration of remission will be reported in patients who achieved CR/CRi, along with the corresponding range., Up to 18 months|Incidence of toxicities, Measured by the Common Terminology Criteria for Adverse Events (CTCAE) version 4.03., Up to day 42|Diagnosis of veno-occlusive disease (VOD), The diagnosis of veno-occlusive disease is based on the Baltimore criteria: Bilirubin \> 2.0 mg/dL, plus, painful hepatomegaly, ascites, and weight gain \> 5% basal since initiating therapy with gemtuzumab ozogamicin (GO). The proportion of patients who develop VOD will be reported along with an exact 95% confidence interval., Up to 18 months|Time to return of normal hematopoiesis, Defined as the number of days from day 1 of induction to ANC (absolute neutrophil count) \>= 1000/uL (upper limit) and platelet count \>= 100,000/uL. Will be reported along with the corresponding range., From day 1 of induction, assessed up to 18 months|Number of participants deceased at day 30 and day 60, Mortality is defined as death having occurred in any participant that receives at least one dose of experimental therapy. Kaplan-Meier methods will estimate the overall survival at day 30 and day 60 following the start of induction. The survival estimate at these two time points will be reported along with a 95% confidence interval., At 30 and 60 days following the start of induction","Genotype at CD33 splicing single nucleotide polymorphism (SNP) RS12459419, Determined by whole exome sequencing and confirmatory genotyping., Up to 18 months|Multidrug resistance activity of leukemia cell P-glycoprotein (Pgp), Will be determined by the flow cytometry mean fluorescence intensity (MFI) of the efflux of the fluorescent dye DiOC2 (Diethyloxacarbocyanine iodide) (by malignant cells. Will be assessed by dye efflux assay as described by Walter et al. 2003., Up to 18 months|Multidrug resistance activity of leukemia cell multidrug resistance protein 1 (MRD1), Will be determined by the flow cytometry efflux MFI of the efflux of the fluorescent dye 5-carboxy-2?,7?-dichlorofluorescein diacetate (CDCF) by malignant cells. Will be assessed by dye efflux assay as described by Walter et al. 2003., Up to 18 months|Exome sequencing analysis, Tumor deoxyribonucleic acid (DNA) and participant DNA will be measured via Illumina HiSeq3000 sequencing platform to evaluate for associations between participant constitutional genotype (buccal swab sample at enrollment), leukemia genotype (bone marrow aspirate at enrollment and upon relapse), and response to therapy., Up to 18 months|Ribonucleic acid (RNA) sequencing analysis, Tumor RNA and participant RNA will be measured via RNA sequencing technique., Up to 18 months","ADULT, OLDER_ADULT",PHASE1,INTERVENTIONAL,Allocation: NA|Intervention Model: SINGLE_GROUP|Masking: NONE|Primary Purpose: TREATMENT,2019-07-18,2023-10-25,2023-10-25,"UCLA / Jonsson Comprehensive Cancer Center, Los Angeles, California, 90095, United States|UC Irvine Health/Chao Family Comprehensive Cancer Center, Orange, California, 92868, United States|University of California Davis Comprehensive Cancer Center, Sacramento, California, 95817, United States|University of California San Diego, San Diego, California, 92103, United States|UCSF Medical Center-Mount Zion, San Francisco, California, 94115, United States",1
NCT03971799,Study of Anti-CD33 Chimeric Antigen Receptor-Expressing T Cells (CD33CART) in Children and Young Adults With Relapsed/Refractory Acute Myeloid Leukemia,https://clinicaltrials.gov/study/NCT03971799,RECRUITING,"This phase 1/2 trial aims to determine the safety and feasibility of antiCD33 chimeric antigen receptor (CAR) expressing T cells (CD33CART) in children and adolescents/young adults (AYAs) with relapsed/refractory acute myeloid leukemia (AML). The trial will be done in two phases: Phase 1 will determine the maximum tolerated dose of CD33CART cells using a 3+3 trial design, with dose-escalation for autologous products separated from dose-escalation for an allogeneic arm. Phase 2 is an expansion phase designed to evaluate the rate of response to CD33CART.",NO,Acute Myelogenous Leukemia,BIOLOGICAL: CD33CART autologous|BIOLOGICAL: CD33CART allogeneic,"Maximum tolerated dose - Autologous Arm, To determine the maximum tolerated dose of lentivirally-transduced autologous CD33-redirected CAR-T cells (CD33CART) in children and young adults with relapsed/refractory AML, Day 28 post CD33CART infusion|Maximum tolerated dose - Allogeneic Arm, To determine the maximum tolerated dose of lentivirally-transduced allogeneic CD33-redirected CAR-T cells (ALLO-CD33CART) in children and young adults with post-HSCT relapsed/refractory AML, Day 28 post CD33CART infusion|Morphologic remission, To determine the percentage of recipients treated with CD33CART who achieve morphologic remission (\<5% blasts in marrow) at Day 28 post-CD33CART cell infusion, Day 28 post CD33CART infusion","Feasibility of CD33CART manufacture, To determine the feasibility of manufacturing CD33CART for recipients with AML, 2 weeks post start of CD33CART manufacture|Feasibility of CD33CART infusion, To determine the feasibility of infusing CD33CART in recipients with AML, 6 weeks post apheresis|Molecular Cytokine release syndrome (CRS), sinusoidal occlusion syndrome (SOS), or other CD33CART related toxicities, To determine the incidence and severity of cytokine release syndrome (CRS), sinusoidal occlusion syndrome (SOS), or other CD33CART related toxicities, 8 weeks post CD33CART infusion|Overall survival, event-free survival and treatment-related mortality, To estimate the overall survival, event-free survival, and treatment-related mortality at Day 28 post-CD33CART, 28 days post CD33CART infusion|Morphologic remission, To determine the percentage of recipients treated with CD33CART who achieve morphologic remission (\<5% blasts in marrow) at Day 28 post-CD33CART cell infusion (for those in Phase I), 28 days post CD33CART infusion|Molecular remission, To determine the percentage of recipients treated with CD33CART who achieve molecular remission (for those with an identified molecular marker) at Day 28 post-CD33CART cell infusion, 28 days post CD33CART infusion|MRD negativity, To determine minimal residual disease \[MRD\] negativity by flow cytometry (\<0.1%) at Day 28 post-CD33CART cell infusion, 28 days post CD33CART infusion|GVHD, To determine the incidence and severity of acute graft-versus-host disease (GVHD) in patients treated on the allogeneic arm (ALLO-CD33CART)., 30 days post CD33CART infusion|Allogeneic hematopoietic stem cell transplantation, To determine the percentage of recipients able to proceed to allogeneic hematopoietic stem cell transplantation following treatment with CD33CART, 6 weeks post CD33CART infusion|SOS and other post-transplant toxicities, For treatment population that subsequently proceeds to HSCT: To determine the percentage of recipients able to proceed to allogeneic hematopoietic stem cell transplantation following treatment with CD33CART, 6 weeks post HCT|Post-HCT time to engraftment, For treatment population that subsequently proceeds to HSCT: To evaluate the post-HCT time to engraftment, transplant related mortality, incidence of acute and chronic graft-versus-host disease (aGVHD and cGVHD)., 6 weeks post HCT",,"CHILD, ADULT",PHASE1|PHASE2,INTERVENTIONAL,Allocation: NON_RANDOMIZED|Intervention Model: SINGLE_GROUP|Masking: NONE|Primary Purpose: TREATMENT,2020-01-08,2029-12,2039-12,"Children's Hospital of Los Angeles, Los Angeles, California, 90027, United States|Children's Hospital of Colorado, Aurora, Colorado, 80045, United States|National Cancer Institute - NIH, Bethesda, Maryland, 20892, United States|Dana-Farber Cancer Institute, Boston, Massachusetts, 02215, United States|The Children's Hospital of Philadelphia, Philadelphia, Pennsylvania, 19104, United States|Seattle Children's Hospital/Fred Hutchinson Cancer Research Center, Seattle, Washington, 98105, United States",1
NCT04257175,CAR-T CD19 for Acute Myelogenous Leukemia With t 8:21 and CD19 Expression,https://clinicaltrials.gov/study/NCT04257175,RECRUITING,"Chimeric antigen receptor (CAR-T) engineered T cells against the CD19 protein have been shown to be effective against acute lymphoma and lymphocytic leukemia and are approved by the US (FDA), European (EMA) and Health Basel.

However, little information exists on using CD19CAR for treatment of recurrent or irresponsible to previous treatment acute myeloid leukemia.

The proposed study will include patients with recurrent disease or those with disease irresponsible to common treatments and they will be treated with CAR-T CD19.",NO,Acute Myeloid Leukemia,BIOLOGICAL: CAR-T CD19,"The change in the peripheral blood counts and differential, Will be evaluated by Coulter counter, Within two years from the introduction of the CAR-T CD19|The change in the antigen expression on the leukemic blasts, Will be evaluated by FACS, Within two years from the introduction of the CAR-T CD19|The change in the measurable residual disease, Will be evaluated by PCR, Within two years from the introduction of the CAR-T CD19|The change in the chromosomal translocations and aberrations, Will be evaluated by cytogenetics and FISH, Within two years from the introduction of the CAR-T CD19",,,"ADULT, OLDER_ADULT",PHASE2|PHASE3,INTERVENTIONAL,Allocation: NA|Intervention Model: SINGLE_GROUP|Masking: NONE|Primary Purpose: TREATMENT,2020-02-18,2024-12-01,2024-12-01,"Chaim Sheba Medical Center, Ramat Gan, 57261, Israel",1
NCT03790072,Ex-vivo Expanded γδ T-lymphocytes (OmnImmune®) in Patients With Acute Myeloid Leukaemia (AML),https://clinicaltrials.gov/study/NCT03790072,COMPLETED,This study investigates the potential curative properties of gamma delta T-cells obtained from a blood-related donor of an AML patient.,NO,Acute Myeloid Leukemia,BIOLOGICAL: OmnImmune®,"Incidence of Treatment-Emergent Adverse Events (AEs) [Safety], Safety of OmnImmune® assessed by incidence of treatment-emergent adverse events (AEs) per patient graded by Common Terminology Criteria for Adverse Events (CTCAE) v5.0, Day 28 after completion of treatment|Incidence of Dose-Limiting Toxicities (DLTs) [Tolerability], Tolerability of OmnImmune® assessed by incidence of dose-limiting toxicities (DLTs) graded by Common Terminology Criteria for Adverse Events (CTCAE) v5.0, Day 28 after completion of treatment","Number of patients reaching Complete Remission (CR) [Efficacy], Efficacy of OmnImmune® assessed by number of patients reaching Complete Remission (CR), 24 months post-treatment|Overall Survival (OS) [Efficacy], Efficacy of OmnImmune® assessed by overall survival (OS) measured in months, 24 months post-treatment|Quality of Life (QoL), Quality of life determined by European Organization for Research and Treatment of Cancer (EORTC) Quality of Life Questionnaire 'C30' which comprises 30 items (i.e. single questions), 24 of which are aggregated into nine multi-item scales, that is, five functioning scales (physical, role, cognitive, emotional and social), three symptom scales (fatigue, pain and nausea/vomiting) and one global health status scale. All of the scales and single-item measures range in score from 0 to 100. A high scale score represents a higher response level. Thus a high score for a functional scale represents a high / healthy level of functioning, a high score for the global health status / QoL represents a high QoL, but a high score for a symptom scale / item represents a high level of symptomatology / problems., 24 months post-treatment","Persistence of γδ T cells, Persistence of γδ T cells assessed by number and phenotype of γδ T cells using flow cytometry assay in peripheral blood and bone marrow from dosed patients, Before treatment and up to 24 months after treatment|Phenotype of γδ T cells, Phenotype of γδ T cells assessed by flow cytometry assay in peripheral blood and bone marrow from dosed patients, Before treatment and up to 24 months after treatment","ADULT, OLDER_ADULT",PHASE1,INTERVENTIONAL,Allocation: NA|Intervention Model: SEQUENTIAL|Masking: NONE|Primary Purpose: TREATMENT,2018-11-27,2021-03-26,2021-03-26,"UHKT (Ustav hematologie a krevni transfuze), Praha, 128 20, Czechia",1
